{
  "resourceType": "Coverage",
  "id": "uh-coverage-001",
  "status": "active",
  "type": {
    "coding": [
      {
        "system": "http://terminology.hl7.org/CodeSystem/v3-ActCode",
        "code": "HMO"
      }
    ]
  },
  "subscriberId": "123456789",
  "beneficiary": {
    "reference": "Patient/uh-patient-123456789"
  },
  "relationship": {
    "coding": [
      {
        "code": "self"
      }
    ]
  },
  "period": {
    "start": "2026-01-01",
    "end": "2026-12-31"
  },
  "payor": [
    {
      "reference": "Organization/uhc-payor",
      "display": "UnitedHealthcare"
    }
  ],
  "class": [
    {
      "type": {
        "coding": [
          {
            "code": "group"
          }
        ]
      },
      "value": "GRP-98765",
      "name": "UHC Choice Plus"
    },
    {
      "type": {
        "coding": [
          {
            "code": "plan"
          }
        ]
      },
      "value": "PLN-CHOICEPLUS-PPO",
      "name": "Choice Plus PPO"
    }
  ]
}